{"cancelled":false,"command":"run","display_truncated":false,"duration_ms":507,"error_excerpt":null,"exit_code":0,"finished_at":"2026-08-31T00:49:22Z","log_path":".muzzle/logs/hello-bash-1788137362024-fe83a34b4d204bb680b5ce68e9ca07cb.log","report_path":".muzzle/reports/hello-bash-1788137362024-fe83a34b4d204bb680b5ce68e9ca07cb.md","schema_version":"muzzle.run/v1","started_at":"2026-08-31T00:49:22Z","status":"success","summary":"The workflow completed successfully.","timed_out":false,"workflow":"hello-bash"}
