{"cancelled":false,"command":"run","display_truncated":false,"duration_ms":743,"error_excerpt":"muzzle-exec: workflow changed after validation; execution denied","exit_code":3,"finished_at":"2026-08-31T00:49:25Z","log_path":".muzzle/logs/race-1788137364756-506f203c81fe4f4286fa50751d1efec8.log","report_path":".muzzle/reports/race-1788137364756-506f203c81fe4f4286fa50751d1efec8.md","schema_version":"muzzle.run/v1","started_at":"2026-08-31T00:49:24Z","status":"failed","summary":"The workflow failed with exit code 3.","timed_out":false,"workflow":"race"}
